{
  "spec_uid": "purple_restoreplus_cooltouch_13_queen",
  "brand": "Purple",
  "collection": "RestorePlus",
  "retailer_variant": "Cool Touch",
  "model_display_name": "Purple RestorePlus Cool Touch 13\" Hybrid — Queen",
  "size": "Queen",
  "profile_height_in": 13,
  "grid_tech": { "type": "GelFlex Grid", "thickness_in": 3 },
  "coil_system": {
    "type": "Zoned pocketed coils",
    "height_in": 8,
    "zones": null,
    "count_queen": 789,
    "edge_support": "Reinforced edge"
  },
  "cover": {
    "construction": "SoftFlex stretch cover",
    "fibers": "Cooling fibers",
    "features": "Mattress Firm–exclusive Cool Touch cover"
  },
  "layers": [
    { "position": 1, "name": "Cover", "material": "SoftFlex + cooling fibers", "thickness_in": null, "notes": "Cool Touch variant" },
    { "position": 2, "name": "Comfort", "material": "GelFlex Grid", "thickness_in": 3, "notes": "" },
    { "position": 3, "name": "Support", "material": "Zoned pocketed coils", "thickness_in": 8, "notes": "Reinforced edge" }
  ],
  "weights": { "queen_lb": 147, "king_lb": null },
  "warranty": {
    "years": 10,
    "foundation_requirements": "Solid, flat, non-flexing base; compatible adjustable base",
    "notes": null
  },
  "retail": {
    "retailers": ["Mattress Firm"],
    "msrp_usd": null,
    "map_usd": null,
    "typical_sale_usd": null
  },
  "media": {
    "hero_image_url": null,
    "xray_image_url": null,
    "datasheet_pdf_url": null
  },
  "evidence": [
    { "source": "Purple", "url": "https://purple.com/mattresses/restore-plus", "claim": "3\" GelFlex Grid hybrid in the Restore Plus tier", "confidence": "High" },
    { "source": "Mattress Firm", "url": "https://www.mattressfirm.com", "claim": "Cool Touch retailer-exclusive cover", "confidence": "High" }
  ],
  "sme": {
    "hero_features": ["3\" GelFlex Grid pressure relief", "Cool-touch cover", "Reinforced edge"],
    "fit_personas": ["Hot sleeper", "Mixed sleeper", "Comfort upgrade"],
    "common_objections": ["Grid feel ‘jiggle’ for some", "Pricier than coil-only hybrids"],
    "positioning_notes": "Sweet spot of pressure relief vs. price in the Restore family."
  },
  "extras": {}
}
